{
  "api_version": "registry.automations.weynear.com/catalog/v1",
  "catalog_version": 11,
  "templates": [
    {
      "artifact": {
        "digest": "sha256:824f1a6db0afaa0877cc8e532c60325c7c48af3a303ff261d082680513bc359f",
        "media_type": "application/vnd.oci.image.manifest.v1+json",
        "platform": {
          "architecture": "amd64",
          "os": "linux"
        },
        "uri": "us-central1-docker.pkg.dev/wahalao/wahalao-automations/weynear/news-feed-publisher@sha256:824f1a6db0afaa0877cc8e532c60325c7c48af3a303ff261d082680513bc359f"
      },
      "bindings": [
        {
          "allowed_scopes": [
            "global",
            "followers",
            "custom"
          ],
          "default_scope": "followers",
          "id": "news-posts",
          "kind": "post_audience",
          "manifest_destination": "news-posts",
          "required": true
        }
      ],
      "bot_required": true,
      "categories": [
        "news"
      ],
      "compatibility": {
        "environments": [
          "test",
          "live"
        ],
        "runtime": "python3.12"
      },
      "configuration": [
        {
          "description": "A reviewed BBC News feed URL. Articles are posted by canonical URL and enriched by Weynear.",
          "display_name": "RSS or Atom feed URL",
          "key": "NEWS_FEED_URL",
          "placeholder": "https://feeds.bbci.co.uk/news/rss.xml",
          "required": false,
          "secret": false,
          "type": "url"
        },
        {
          "description": "Limits each hourly run so a busy feed cannot flood the selected audience.",
          "display_name": "Maximum articles per run",
          "key": "MAX_ITEMS_PER_RUN",
          "maximum": 20,
          "minimum": 1,
          "required": false,
          "secret": false,
          "type": "integer"
        }
      ],
      "display_name": "Breaking News Feed",
      "icon_url": "",
      "install_manifest": {
        "digest": "sha256:b30ab344049daac8132b4150524f419ae6d4e7b23e01a5128d91b4fc7a53f88c",
        "path": "manifests/weynear/news-feed-publisher/1.0.0/manifest.yaml"
      },
      "license": "Apache-2.0",
      "moderation": {
        "content_kind": "news-links",
        "sources_required": true
      },
      "name": "news-feed-publisher",
      "publisher": "weynear",
      "publisher_verification": {
        "publisher_record_digest": "sha256:688906f409533d17ef7a1288aecf50dcdc47b27b06563c12ea897a003428395a",
        "required_attestations": [
          "slsa-provenance-v1",
          "spdx-2.3"
        ],
        "signature": {
          "algorithm": "ec-sign-p256-sha256",
          "kms_key_resource": "projects/wahalao/locations/global/keyRings/automation-registry/cryptoKeys/catalog-signing/cryptoKeyVersions/1"
        },
        "trusted_builders": [
          "https://github.com/ericel/wahalao-automation/.github/workflows/release-sports-template.yml@refs/heads/main",
          "https://github.com/ericel/weynear-templates/.github/workflows/build-template.yml@refs/heads/main"
        ]
      },
      "recipe_digest": "sha256:39140707e9b1a916da419e3189cecffe4721f5da6dea7f1558613d3ad64819e1",
      "runtime_adapter": "news-feed-publisher-v1",
      "source": {
        "commit": "7b17f2f6fb2fa477492e63e3ca7e43771c7a9a1b",
        "path": "templates/news-feed-publisher",
        "repository": "https://github.com/ericel/wahalao-template-maker"
      },
      "status": "approved",
      "summary": "Publish new articles from a reviewed RSS or Atom feed using Weynear's native link previews.",
      "tags": [
        "rss",
        "atom",
        "breaking-news",
        "link-preview"
      ],
      "version": "1.0.0"
    },
    {
      "artifact": {
        "digest": "sha256:2755312f4f070fe80aa793341c051e65998699fa30840da9a8e4722f278414ed",
        "media_type": "application/vnd.oci.image.manifest.v1+json",
        "platform": {
          "architecture": "amd64",
          "os": "linux"
        },
        "uri": "us-central1-docker.pkg.dev/wahalao/wahalao-automations/weynear/sports-live-scores@sha256:2755312f4f070fe80aa793341c051e65998699fa30840da9a8e4722f278414ed"
      },
      "bindings": [
        {
          "allowed_scopes": [
            "global",
            "followers",
            "custom"
          ],
          "default_scope": "global",
          "id": "score-posts",
          "kind": "post_audience",
          "manifest_destination": "epl-public-posts",
          "required": true
        }
      ],
      "bot_required": true,
      "categories": [
        "sports"
      ],
      "compatibility": {
        "environments": [
          "test",
          "live"
        ],
        "runtime": "python3.12"
      },
      "configuration": [],
      "display_name": "Live Sports Scores",
      "icon_url": "",
      "install_manifest": {
        "digest": "sha256:3775cbc3f12fa5ac848316bd87ef083e886b45bf64e7115cd5096420ac260859",
        "path": "manifests/weynear/sports-live-scores/1.0.0/manifest.yaml"
      },
      "license": "Apache-2.0",
      "moderation": {
        "content_kind": "sports-scores",
        "sources_required": true
      },
      "name": "sports-live-scores",
      "publisher": "weynear",
      "publisher_verification": {
        "publisher_record_digest": "sha256:688906f409533d17ef7a1288aecf50dcdc47b27b06563c12ea897a003428395a",
        "required_attestations": [
          "slsa-provenance-v1",
          "spdx-2.3"
        ],
        "signature": {
          "algorithm": "ec-sign-p256-sha256",
          "kms_key_resource": "projects/wahalao/locations/global/keyRings/automation-registry/cryptoKeys/catalog-signing/cryptoKeyVersions/1"
        },
        "trusted_builders": [
          "https://github.com/ericel/wahalao-automation/.github/workflows/release-sports-template.yml@refs/heads/main",
          "https://github.com/ericel/weynear-templates/.github/workflows/build-template.yml@refs/heads/main"
        ]
      },
      "recipe_digest": "sha256:beadf35d6115a48e93b162f11eec1fb62486b8243758fff9a969a8d07f0be27c",
      "runtime_adapter": "sports-live-scores-v1",
      "source": {
        "commit": "ab52a0ac8ddff201f8e6685a38cf726e833ab55f",
        "path": "trusted_builtins/sports_live_scores",
        "repository": "https://github.com/ericel/wahalao-automation"
      },
      "status": "approved",
      "summary": "Publish native score cards when a live match changes.",
      "tags": [
        "live-scores",
        "football"
      ],
      "version": "1.0.0"
    },
    {
      "artifact": {
        "digest": "sha256:2755312f4f070fe80aa793341c051e65998699fa30840da9a8e4722f278414ed",
        "media_type": "application/vnd.oci.image.manifest.v1+json",
        "platform": {
          "architecture": "amd64",
          "os": "linux"
        },
        "uri": "us-central1-docker.pkg.dev/wahalao/wahalao-automations/weynear/sports-live-scores@sha256:2755312f4f070fe80aa793341c051e65998699fa30840da9a8e4722f278414ed"
      },
      "bindings": [
        {
          "allowed_scopes": [
            "global",
            "followers",
            "custom"
          ],
          "default_scope": "global",
          "id": "score-posts",
          "kind": "post_audience",
          "manifest_destination": "epl-public-posts",
          "required": true
        }
      ],
      "bot_required": true,
      "categories": [
        "sports"
      ],
      "compatibility": {
        "environments": [
          "test",
          "live"
        ],
        "runtime": "python3.12"
      },
      "configuration": [
        {
          "description": "API token issued by the configured sports data provider.",
          "key": "SPORTS_API_TOKEN",
          "required": false,
          "required_environments": [
            "live"
          ],
          "secret": true,
          "secret_type": "bearer_token",
          "type": "string"
        }
      ],
      "display_name": "Live Sports Scores",
      "icon_url": "",
      "install_manifest": {
        "digest": "sha256:3775cbc3f12fa5ac848316bd87ef083e886b45bf64e7115cd5096420ac260859",
        "path": "manifests/weynear/sports-live-scores/1.1.0/manifest.yaml"
      },
      "license": "Apache-2.0",
      "moderation": {
        "content_kind": "sports-scores",
        "sources_required": true
      },
      "name": "sports-live-scores",
      "publisher": "weynear",
      "publisher_verification": {
        "publisher_record_digest": "sha256:688906f409533d17ef7a1288aecf50dcdc47b27b06563c12ea897a003428395a",
        "required_attestations": [
          "slsa-provenance-v1",
          "spdx-2.3"
        ],
        "signature": {
          "algorithm": "ec-sign-p256-sha256",
          "kms_key_resource": "projects/wahalao/locations/global/keyRings/automation-registry/cryptoKeys/catalog-signing/cryptoKeyVersions/1"
        },
        "trusted_builders": [
          "https://github.com/ericel/wahalao-automation/.github/workflows/release-sports-template.yml@refs/heads/main",
          "https://github.com/ericel/weynear-templates/.github/workflows/build-template.yml@refs/heads/main"
        ]
      },
      "recipe_digest": "sha256:a1d19edcf1cc5a40361a1aa0ee4c7510980e5a1ab0f8bd0ea08a398ece97f49c",
      "runtime_adapter": "sports-live-scores-v1",
      "source": {
        "commit": "ab52a0ac8ddff201f8e6685a38cf726e833ab55f",
        "path": "trusted_builtins/sports_live_scores",
        "repository": "https://github.com/ericel/wahalao-automation"
      },
      "status": "approved",
      "summary": "Publish native score cards when a live match changes.",
      "tags": [
        "live-scores",
        "football"
      ],
      "version": "1.1.0"
    },
    {
      "artifact": {
        "digest": "sha256:2755312f4f070fe80aa793341c051e65998699fa30840da9a8e4722f278414ed",
        "media_type": "application/vnd.oci.image.manifest.v1+json",
        "platform": {
          "architecture": "amd64",
          "os": "linux"
        },